{
  "id": "oahl-adapter-mock",
  "name": "Mock Hardware Adapter",
  "description": "A simulated hardware adapter for testing OAHL core and client SDKs without physical devices.",
  "author": "fredabila",
  "repository": "https://github.com/fredabila/oahl/tree/main/adapters/adapter-mock",
  "npm_package": "@oahl/adapter-mock",
  "hardware_tags": ["mock", "testing", "simulation"],
  "capabilities": ["mock.ping", "mock.echo"],
  "license": "Apache-2.0"
}
